{
 "format": "splashed-ink-plan/v2",
 "source": "synthetic-fish",
 "aspect": 0.7477,
 "paperSeed": 896466344,
 "sim": {
  "width": 80,
  "height": 107,
  "stepsPerSecond": 360
 },
 "note": "Strokes are inferred from the final image. Draw order and direction are heuristics. Dryness is measured from gaps in the original where they show, plus an assumed fade toward each tip.",
 "brush": {
  "baseRadius": "0.05 x short side",
  "radius": "baseRadius x size",
  "waterPerStep": "0.06 x min(size^2, 2.5) for washes"
 },
 "sequenceColumns": [
  "dx",
  "dy",
  "width",
  "ink",
  "dry",
  "pen_down",
  "pen_up",
  "end"
 ],
 "sequenceUnits": "dx, dy and width are fractions of the short side. Broad wash strokes come first (width is twice the local radius), then round pours as single-point strokes whose width is the disc diameter, then the lines.",
 "washStrokes": [
  {
   "dry": false,
   "points": [
    [
     0.3812,
     0.4133,
     0.0598,
     0.983,
     0.12
    ],
    [
     0.7937,
     0.4299,
     0.035,
     0.315,
     0.62
    ]
   ]
  },
  {
   "dry": false,
   "points": [
    [
     0.3812,
     0.4932,
     0.0598,
     0.983,
     0.12
    ],
    [
     0.7937,
     0.4766,
     0.035,
     0.315,
     0.62
    ]
   ]
  }
 ],
 "washes": [
  {
   "x": 0.5563,
   "y": 0.5093,
   "radius": 0.0515,
   "size": 0.5,
   "seconds": 0.943,
   "ink": 3.504
  },
  {
   "x": 0.2938,
   "y": 0.472,
   "radius": 0.05,
   "size": 0.5,
   "seconds": 0.811,
   "ink": 2.411
  },
  {
   "x": 0.4437,
   "y": 0.5187,
   "radius": 0.05,
   "size": 0.5,
   "seconds": 0.811,
   "ink": 2.951
  },
  {
   "x": 0.4938,
   "y": 0.5187,
   "radius": 0.05,
   "size": 0.5,
   "seconds": 0.811,
   "ink": 3.05
  }
 ],
 "strokes": [
  {
   "points": [
    [
     0.1938,
     0.7617,
     0.0375,
     0.768,
     0.06
    ],
    [
     0.4188,
     0.7991,
     0.0375,
     0.862,
     0.069
    ],
    [
     0.6687,
     0.7804,
     0.0375,
     0.818,
     0.134
    ],
    [
     0.8562,
     0.8178,
     0.0229,
     0.544,
     0.31
    ]
   ]
  },
  {
   "points": [
    [
     0.8438,
     0.5187,
     0.0434,
     0.483,
     0.06
    ],
    [
     0.8063,
     0.4813,
     0.0696,
     0.772,
     0.069
    ],
    [
     0.8012,
     0.4439,
     0.0684,
     0.835,
     0.134
    ],
    [
     0.8438,
     0.4065,
     0.0375,
     0.476,
     0.31
    ]
   ]
  },
  {
   "points": [
    [
     0.3812,
     0.7991,
     0.0375,
     0.782,
     0.06
    ],
    [
     0.3937,
     0.7991,
     0.0375,
     0.879,
     0.31
    ]
   ]
  },
  {
   "points": [
    [
     0.2437,
     0.771,
     0.0375,
     0.795,
     0.06
    ],
    [
     0.2562,
     0.771,
     0.0375,
     0.886,
     0.31
    ]
   ]
  },
  {
   "points": [
    [
     0.2687,
     0.4533,
     0.0582,
     0.711,
     0.06
    ]
   ]
  },
  {
   "points": [
    [
     0.7937,
     0.4626,
     0.0875,
     1.233,
     0.06
    ],
    [
     0.7688,
     0.4533,
     0.0724,
     0.956,
     0.091
    ],
    [
     0.7188,
     0.4533,
     0.0625,
     0.935,
     0.31
    ]
   ]
  },
  {
   "points": [
    [
     0.7937,
     0.4533,
     0.0875,
     1.22,
     0.06
    ],
    [
     0.7937,
     0.4626,
     0.0875,
     1.233,
     0.31
    ]
   ]
  }
 ],
 "sequence": [
  [
   0.3812,
   0.5528,
   0.1196,
   0.983,
   0.12,
   1,
   0,
   0
  ],
  [
   0.4125,
   0.0222,
   0.07,
   0.315,
   0.62,
   0,
   1,
   0
  ],
  [
   -0.4125,
   0.0847,
   0.1196,
   0.983,
   0.12,
   1,
   0,
   0
  ],
  [
   0.4125,
   -0.0222,
   0.07,
   0.315,
   0.62,
   0,
   1,
   0
  ],
  [
   -0.2375,
   0.0437,
   0.1031,
   0.854,
   0,
   0,
   1,
   0
  ],
  [
   -0.2625,
   -0.05,
   0.1,
   0.695,
   0,
   0,
   1,
   0
  ],
  [
   0.15,
   0.0625,
   0.1,
   0.767,
   0,
   0,
   1,
   0
  ],
  [
   0.05,
   0,
   0.1,
   0.778,
   0,
   0,
   1,
   0
  ],
  [
   -0.3,
   0.325,
   0.0375,
   0.554,
   0.06,
   1,
   0,
   0
  ],
  [
   0.225,
   0.05,
   0.0375,
   0.595,
   0.069,
   1,
   0,
   0
  ],
  [
   0.25,
   -0.025,
   0.0375,
   0.577,
   0.134,
   1,
   0,
   0
  ],
  [
   0.1875,
   0.05,
   0.0229,
   0.435,
   0.31,
   0,
   1,
   0
  ],
  [
   -0.0125,
   -0.4,
   0.0434,
   0.398,
   0.06,
   1,
   0,
   0
  ],
  [
   -0.0375,
   -0.05,
   0.0696,
   0.556,
   0.069,
   1,
   0,
   0
  ],
  [
   -0.005,
   -0.05,
   0.0684,
   0.584,
   0.134,
   1,
   0,
   0
  ],
  [
   0.0425,
   -0.05,
   0.0375,
   0.393,
   0.31,
   0,
   1,
   0
  ],
  [
   -0.4625,
   0.525,
   0.0375,
   0.56,
   0.06,
   1,
   0,
   0
  ],
  [
   0.0125,
   0,
   0.0375,
   0.603,
   0.31,
   0,
   1,
   0
  ],
  [
   -0.15,
   -0.0375,
   0.0375,
   0.566,
   0.06,
   1,
   0,
   0
  ],
  [
   0.0125,
   0,
   0.0375,
   0.606,
   0.31,
   0,
   1,
   0
  ],
  [
   0.0125,
   -0.425,
   0.0582,
   0.526,
   0.06,
   0,
   1,
   0
  ],
  [
   0.525,
   0.0125,
   0.0875,
   0.726,
   0.06,
   1,
   0,
   0
  ],
  [
   -0.025,
   -0.0125,
   0.0724,
   0.634,
   0.091,
   1,
   0,
   0
  ],
  [
   -0.05,
   0,
   0.0625,
   0.625,
   0.31,
   0,
   1,
   0
  ],
  [
   0.075,
   0,
   0.0875,
   0.722,
   0.06,
   1,
   0,
   0
  ],
  [
   0,
   0.0125,
   0.0875,
   0.726,
   0.31,
   0,
   1,
   1
  ]
 ]
}